UC1 :Ability to create a payroll service database

mysql> create database payroll_service;
ERROR 1007 (HY000): Can't create database 'payroll_service'; database exists
mysql> create database payroll_services;
ERROR 1007 (HY000): Can't create database 'payroll_services'; database exists
mysql> create database Employee_payroll_services;
Query OK, 1 row affected (0.04 sec)

mysql> show database;
ERROR 1064 (42000): You have an error in your SQL syntax; check the manual that corresponds to your MySQL server version for the right syntax to use near 'database' at line 1
mysql> show databases;
+---------------------------+
| Database                  |
+---------------------------+
| address_book_system       |
| addressbookservice        |
| blz                       |
| employee_payroll_services |
| information_schema        |
| mysql                     |
| payroll_service           |
| payroll_services          |
| performance_schema        |
| sys                       |
+---------------------------+
10 rows in set (0.04 sec)

UC2_Create_Table

mysql> use payroll_service_new
Database changed
mysql> create table employee_payroll(
    -> id int unsigned not null auto_increment,
    -> name varchar(100) not null,
    -> salary double not null,
    -> start date not null,
    -> primary key(id));
Query OK, 0 rows affected (0.26 sec)

mysql> desc employee_payroll;
+--------+--------------+------+-----+---------+----------------+
| Field  | Type         | Null | Key | Default | Extra          |
+--------+--------------+------+-----+---------+----------------+
| id     | int unsigned | NO   | PRI | NULL    | auto_increment |
| name   | varchar(100) | NO   |     | NULL    |                |
| salary | double       | NO   |     | NULL    |                |
| start  | date         | NO   |     | NULL    |                |
+--------+--------------+------+-----+---------+----------------+
4 rows in set (0.08 sec)

UC3_Insert_DataBase

mysql> insert into employee_payroll(name,salary,start)values ('Bill',1000000.00,'2010-10-30'),('Tersia',2000000.00,'2019-11-13'),('Charlie',300000.00,'2020-05-21');
Query OK, 3 rows affected (0.16 sec)
Records: 3  Duplicates: 0  Warnings: 0

UC4_Retrieve_Data

mysql> select * from employee_payroll;
+----+---------+---------+------------+
| id | name    | salary  | Start      |
+----+---------+---------+------------+
|  1 | Bill    | 1000000 | 2010-10-30 |
|  2 | Tersia  | 2000000 | 2019-11-13 |
|  3 | Charlie |  300000 | 2020-05-21 |
+----+---------+---------+------------+
3 rows in set (0.00 sec)

UC5_Retrieve data for particular employee and joined in data range

mysql> select * salary from employee_payroll where name='Bill';
ERROR 1064 (42000): You have an error in your SQL syntax; check the manual that corresponds to your MySQL server version for the right syntax to use near 'salary from employee_payroll where name='Bill'' at line 1
mysql> select * from employee_payroll where name='Bill';
+----+------+---------+------------+
| id | name | salary  | Start      |
+----+------+---------+------------+
|  1 | Bill | 1000000 | 2010-10-30 |
+----+------+---------+------------+
1 row in set (0.00 sec)

mysql> select * from employee_payroll where start between '2018-01-01' AND Date(now());
+----+---------+---------+------------+
| id | name    | salary  | Start      |
+----+---------+---------+------------+
|  2 | Tersia  | 2000000 | 2019-11-13 |
|  3 | Charlie |  300000 | 2020-05-21 |
+----+---------+---------+------------+
2 rows in set (0.00 sec)

UC6:Adding Gender to the Table.

mysql> ALTER TABLE employee_payroll ADD gender CHAR(1) AFTER name;
Query OK, 0 rows affected (0.08 sec)
Records: 0  Duplicates: 0  Warnings: 0

mysql> describe employee_payroll;
+--------+--------------+------+-----+---------+----------------+
| Field  | Type         | Null | Key | Default | Extra          |
+--------+--------------+------+-----+---------+----------------+
| id     | int unsigned | NO   | PRI | NULL    | auto_increment |
| name   | varchar(100) | NO   |     | NULL    |                |
| gender | char(1)      | YES  |     | NULL    |                |
| salary | double       | NO   |     | NULL    |                |
| Start  | date         | NO   |     | NULL    |                |
+--------+--------------+------+-----+---------+----------------+
5 rows in set (0.00 sec)

mysql> update employee_payroll set gender = 'F' WHERE name = 'Bill' or name = 'charlie';
Query OK, 2 rows affected (0.01 sec)
Rows matched: 2  Changed: 2  Warnings: 0

mysql> describe employee_payroll;
+--------+--------------+------+-----+---------+----------------+
| Field  | Type         | Null | Key | Default | Extra          |
+--------+--------------+------+-----+---------+----------------+
| id     | int unsigned | NO   | PRI | NULL    | auto_increment |
| name   | varchar(100) | NO   |     | NULL    |                |
| gender | char(1)      | YES  |     | NULL    |                |
| salary | double       | NO   |     | NULL    |                |
| Start  | date         | NO   |     | NULL    |                |
+--------+--------------+------+-----+---------+----------------+
5 rows in set (0.00 sec)
mysql> update employee_payroll set gender = 'M' WHERE name = 'Bill' or name = 'charlie';
Query OK, 2 rows affected (0.00 sec)
Rows matched: 2  Changed: 2  Warnings: 0

mysql> SELECT * FROM employee_payroll;
+----+---------+--------+---------+------------+
| id | name    | gender | salary  | Start      |
+----+---------+--------+---------+------------+
|  1 | Bill    | M      | 1000000 | 2010-10-30 |
|  2 | Tersia  | NULL   | 2000000 | 2019-11-13 |
|  3 | Charlie | M      |  300000 | 2020-05-21 |
+----+---------+--------+---------+------------+
3 rows in set (0.00 sec)

mysql> update employee_payroll set gender ='F' WHERE name = 'Terisa';
Query OK, 0 rows affected (0.00 sec)
Rows matched: 0  Changed: 0  Warnings: 0

mysql> SELECT * FROM employee_payroll;
+----+---------+--------+---------+------------+
| id | name    | gender | salary  | Start      |
+----+---------+--------+---------+------------+
|  1 | Bill    | M      | 1000000 | 2010-10-30 |
|  2 | Tersia  | NULL   | 2000000 | 2019-11-13 |
|  3 | Charlie | M      |  300000 | 2020-05-21 |
+----+---------+--------+---------+------------+
3 rows in set (0.00 sec)

mysql> update employee_payroll set gender ='F' WHERE name = 'Terisa';
Query OK, 0 rows affected (0.00 sec)
Rows matched: 0  Changed: 0  Warnings: 0

mysql> update employee_payroll set gender ='F' WHERE name = 'Tersia';
Query OK, 1 row affected (0.00 sec)
Rows matched: 1  Changed: 1  Warnings: 0

mysql> SELECT * FROM employee_payroll;
+----+---------+--------+---------+------------+
| id | name    | gender | salary  | Start      |
+----+---------+--------+---------+------------+
|  1 | Bill    | M      | 1000000 | 2010-10-30 |
|  2 | Tersia  | F      | 2000000 | 2019-11-13 |
|  3 | Charlie | M      |  300000 | 2020-05-21 |
+----+---------+--------+---------+------------+
3 rows in set (0.00 sec)

UC7: Find sum avg max min.

mysql> select sum(salary) from employee_payroll where gender = 'M' group by gender;
+-------------+
| sum(salary) |
+-------------+
|     1300000 |
+-------------+
1 row in set (0.00 sec)

mysql> select avg(salary) from employee_payroll where gender = 'M' group by gender;
+-------------+
| avg(salary) |
+-------------+
|      650000 |
+-------------+
1 row in set (0.00 sec)

mysql> select gender,count(salary) from employee_payroll group by gender;
+--------+---------------+
| gender | count(salary) |
+--------+---------------+
| M      |             2 |
| F      |             1 |
+--------+---------------+
2 rows in set (0.00 sec)

mysql> select min(salary) from employee_payroll where gender = 'M' group by gender;
+-------------+
| min(salary) |
+-------------+
|      300000 |
+-------------+
1 row in set (0.00 sec)

mysql> select max(salary) from employee_payroll where gender = 'F' group by gender;
+-------------+
| max(salary) |
+-------------+
|     2000000 |
+-------------+
1 row in set (0.00 sec)

mysql> select count(salary) from employee_payroll where gender = 'M' group by gender;
+---------------+
| count(salary) |
+---------------+
|             2 |
+---------------+
1 row in set (0.00 sec)

mysql> select count(salary) from employee_payroll where gender = 'F' group by gender;
+---------------+
| count(salary) |
+---------------+
|             1 |
+---------------+
1 row in set (0.00 sec)

mysql> select count(salary) from employee_payroll where gender = 'F' group by gender;


UC8: Extend employee_payroll data to store employee information like phone no.,department,address.

mysql> desc employee_payroll;
+--------+--------------+------+-----+---------+----------------+
| Field  | Type         | Null | Key | Default | Extra          |
+--------+--------------+------+-----+---------+----------------+
| id     | int unsigned | NO   | PRI | NULL    | auto_increment |
| name   | varchar(100) | NO   |     | NULL    |                |
| gender | char(1)      | YES  |     | NULL    |                |
| salary | double       | NO   |     | NULL    |                |
| Start  | date         | NO   |     | NULL    |                |
+--------+--------------+------+-----+---------+----------------+
5 rows in set (0.00 sec)

mysql> ALTER TABLE employee_payroll ADD Phone int(12);
Query OK, 0 rows affected, 1 warning (0.03 sec)
Records: 0  Duplicates: 0  Warnings: 1

mysql> ALTER TABLE employee_payroll ADD Department varchar(250);
Query OK, 0 rows affected (0.02 sec)
Records: 0  Duplicates: 0  Warnings: 0

mysql> ALTER TABLE employee_payroll ADD Address varchar(200);
Query OK, 0 rows affected (0.01 sec)
Records: 0  Duplicates: 0  Warnings: 0

mysql> SELECT * FROM employee_payroll;
+----+---------+--------+---------+------------+-------+------------+---------+
| id | name    | gender | salary  | Start      | Phone | Department | Address |
+----+---------+--------+---------+------------+-------+------------+---------+
|  1 | Bill    | M      | 1000000 | 2010-10-30 |  NULL | NULL       | NULL    |
|  2 | Tersia  | F      | 2000000 | 2019-11-13 |  NULL | NULL       | NULL    |
|  3 | Charlie | M      |  300000 | 2020-05-21 |  NULL | NULL       | NULL    |
+----+---------+--------+---------+------------+-------+------------+---------+
3 rows in set (0.00 sec)

mysql> ALTER TABLE employee_payroll ALTER Address SET DEFAULT 'Mumbai';
Query OK, 0 rows affected (0.01 sec)
Records: 0  Duplicates: 0  Warnings: 0

mysql> SELECT * FROM employee_payroll;
+----+---------+--------+---------+------------+-------+------------+---------+
| id | name    | gender | salary  | Start      | Phone | Department | Address |
+----+---------+--------+---------+------------+-------+------------+---------+
|  1 | Bill    | M      | 1000000 | 2010-10-30 |  NULL | NULL       | NULL    |
|  2 | Tersia  | F      | 2000000 | 2019-11-13 |  NULL | NULL       | NULL    |
|  3 | Charlie | M      |  300000 | 2020-05-21 |  NULL | NULL       | NULL    |
+----+---------+--------+---------+------------+-------+------------+---------+
3 rows in set (0.00 sec)

UC9_Extend table to have Basic pay,Deduction,Taxable pay,Income tax,Net pay.

mysql> SELECT * FROM employee_payroll;
+----+---------+--------+---------+------------+-------+------------+---------+
| id | name    | gender | salary  | Start      | Phone | Department | Address |
+----+---------+--------+---------+------------+-------+------------+---------+
|  1 | Bill    | M      | 1000000 | 2010-10-30 |  NULL | NULL       | NULL    |
|  2 | Tersia  | F      | 2000000 | 2019-11-13 |  NULL | NULL       | NULL    |
|  3 | Charlie | M      |  300000 | 2020-05-21 |  NULL | NULL       | NULL    |
+----+---------+--------+---------+------------+-------+------------+---------+
3 rows in set (0.00 sec)

mysql> ALTER TABLE employee_payroll ADD basicPay Double;
Query OK, 0 rows affected (0.02 sec)
Records: 0  Duplicates: 0  Warnings: 0

mysql> ALTER TABLE employee_payroll ADD Deductions Double;
Query OK, 0 rows affected (0.01 sec)
Records: 0  Duplicates: 0  Warnings: 0

mysql> ALTER TABLE employee_payroll ADD TaxablePay Double;
Query OK, 0 rows affected (0.01 sec)
Records: 0  Duplicates: 0  Warnings: 0

mysql> ALTER TABLE employee_payroll ADD IncomeTax Double;
Query OK, 0 rows affected (0.02 sec)
Records: 0  Duplicates: 0  Warnings: 0

mysql> ALTER TABLE employee_payroll ADD NetPay Double;
Query OK, 0 rows affected (0.01 sec)
Records: 0  Duplicates: 0  Warnings: 0

mysql> SELECT * FROM employee_payroll;
+----+---------+--------+---------+------------+-------+------------+---------+----------+------------+------------+-----------+--------+
| id | name    | gender | salary  | Start      | Phone | Department | Address | basicPay | Deductions | TaxablePay | IncomeTax | NetPay |
+----+---------+--------+---------+------------+-------+------------+---------+----------+------------+------------+-----------+--------+
|  1 | Bill    | M      | 1000000 | 2010-10-30 |  NULL | NULL       | NULL    |     NULL |       NULL |       NULL |      NULL |   NULL |
|  2 | Tersia  | F      | 2000000 | 2019-11-13 |  NULL | NULL       | NULL    |     NULL |       NULL |       NULL |      NULL |   NULL |
|  3 | Charlie | M      |  300000 | 2020-05-21 |  NULL | NULL       | NULL    |     NULL |       NULL |       NULL |      NULL |   NULL |
+----+---------+--------+---------+------------+-------+------------+---------+----------+------------+------------+-----------+--------+
3 rows in set (0.00 sec


UC10: Draw ER Diagram for payroll service.


mysql> select * from employee_payroll;
+----+---------+--------+---------+------------+-------+------------+---------+----------+------------+------------+-----------+--------+
| id | name    | gender | salary  | Start      | Phone | Department | Address | basicPay | Deductions | TaxablePay | IncomeTax | NetPay |
+----+---------+--------+---------+------------+-------+------------+---------+----------+------------+------------+-----------+--------+
|  1 | Bill    | M      | 1000000 | 2010-10-30 |  NULL | NULL       | NULL    |     NULL |       NULL |       NULL |      NULL |   NULL |
|  2 | Tersia  | F      | 2000000 | 2019-11-13 |  NULL | NULL       | NULL    |     NULL |       NULL |       NULL |      NULL |   NULL |
|  3 | Charlie | M      |  300000 | 2020-05-21 |  NULL | NULL       | NULL    |     NULL |       NULL |       NULL |      NULL |   NULL |
+----+---------+--------+---------+------------+-------+------------+---------+----------+------------+------------+-----------+--------+
3 rows in set (0.01 sec)

mysql>  CREATE TABLE Department ( department varchar(250) NOT NULL, PRIMARY KEY (department) );
Query OK, 0 rows affected (0.06 sec)

mysql> INSERT INTO Department ( department ) VALUES ('Sales'),('Marketing');
Query OK, 2 rows affected (0.01 sec)
Records: 2  Duplicates: 0  Warnings: 0

mysql> SELECT * FROM Department;
+------------+
| department |
+------------+
| Marketing  |
| Sales      |
+------------+
2 rows in set (0.00 sec)


UC11: Implement ER diagram into payroll service db


mysql>  CREATE TABLE Employee ( id int, compID int, PhoneNumbe BIGINT(13), Address varchar(25), gender char(1),
    -> PRIMARY KEY (id) );
Query OK, 0 rows affected, 1 warning (0.02 sec)
mysql> INSERT INTO Employee (id, compID, PhoneNumbe, Address, gender) VALUES ( 1, 10, 7775827779, 'Mubai', 'F'),
    -> (2, 11, 7775828889, 'Mumbai', 'M');
Query OK, 2 rows affected (0.00 sec)
Records: 2  Duplicates: 0  Warnings: 0

mysql>  SELECT * FROM Employee;
+----+--------+------------+---------+--------+
| id | compID | PhoneNumbe | Address | gender |
+----+--------+------------+---------+--------+
|  1 |     10 | 7775827779 | Mubai   | F      |
|  2 |     11 | 7775828889 | Mumbai  | M      |
+----+--------+------------+---------+--------+
2 rows in set (0.00 sec)

mysql> CREATE TABLE Emp_Department (empID int, Depart varchar(250) NOT NULL, FOREIGN KEY (empID) REFERENCES Employee (id),
    -> FOREIGN KEY (Depart) REFERENCES Department (department), PRIMARY KEY (empID, Depart));
Query OK, 0 rows affected (0.04 sec)

mysql> describe Emp_Department;
+--------+--------------+------+-----+---------+-------+
| Field  | Type         | Null | Key | Default | Extra |
+--------+--------------+------+-----+---------+-------+
| empID  | int          | NO   | PRI | NULL    |       |
| Depart | varchar(250) | NO   | PRI | NULL    |       |
+--------+--------------+------+-----+---------+-------+
2 rows in set (0.00 sec)

mysql> INSERT INTO Emp_Department (empID, Depart) VALUES (1, 'Marketing');
Query OK, 1 row affected (0.01 sec)

mysql> INSERT INTO Emp_Department (empID, Depart) VALUES (1, 'Sales');
Query OK, 1 row affected (0.00 sec)

mysql>  INSERT INTO Emp_Department (empID, Depart) VALUES (2, 'Sales');
Query OK, 1 row affected (0.00 sec)

mysql> INSERT INTO Emp_Department (empID, Depart) VALUES (2, 'Marketing');
Query OK, 1 row affected (0.00 sec)

mysql> SELECT * FROM Emp_Department;
+-------+-----------+
| empID | Depart    |
+-------+-----------+
|     1 | Marketing |
|     2 | Marketing |
|     1 | Sales     |
|     2 | Sales     |
+-------+-----------+
4 rows in set (0.00 sec)


UC12: Ensure all retrive queries done especially UC4,UC5 And Uc7


mysql> SELECT * FROM Emp_Department;
+-------+-----------+
| empID | Depart    |
+-------+-----------+
|     1 | Marketing |
|     2 | Marketing |
|     1 | Sales     |
|     2 | Sales     |
+-------+-----------+
4 rows in set (0.00 sec)

mysql> SELECT * FROM Emp_Department WHERE empID = 1;
+-------+-----------+
| empID | Depart    |
+-------+-----------+
|     1 | Marketing |
|     1 | Sales     |
+-------+-----------+
2 rows in set (0.00 sec)

mysql> SELECT * FROM Department WHERE department = 1;
Empty set, 2 warnings (0.00 sec)

mysql> SELECT * FROM Department WHERE department = 'sales';
+------------+
| department |
+------------+
| Sales      |
+------------+
1 row in set (0.00 sec)
